Release Date,Season,Episode,Episode Title,Name,Sentence
2011-05-01,Season 1,Episode 3,Lord Snow,daenerys targaryen,Not a Queen. A Khaleesi.
2011-05-01,Season 1,Episode 3,Lord Snow,viserys targaryen,You dare! You give commands to me? To me? You do not command the dragon. I am Lord of the Seven Kingdoms. I don't take orders from savages or their sluts. Do you hear me?
2011-05-01,Season 1,Episode 3,Lord Snow,irri,"Rakharo ask if you want him dead, Khaleesi."
2011-05-01,Season 1,Episode 3,Lord Snow,daenerys targaryen,No!
2011-05-01,Season 1,Episode 3,Lord Snow,irri,"Rakharo say you should take ear, to teach respect."
2011-05-01,Season 1,Episode 3,Lord Snow,daenerys targaryen,"Please please, don't hurt him. Tell him I don't want my brother harmed."
2011-05-01,Season 1,Episode 3,Lord Snow,viserys targaryen,Kill these Dothraki dogs! I am your King!
2011-05-01,Season 1,Episode 3,Lord Snow,jorah mormont,"Shall we return to the Khalasar, Khaleesi?"
2011-05-01,Season 1,Episode 3,Lord Snow,rakharo,You walk. [to Viserys]
2011-05-01,Season 1,Episode 3,Lord Snow,benjen stark,I wanted to be here when you saw it for the first time. I'm leaving this morning.
2011-05-01,Season 1,Episode 3,Lord Snow,jon snow,You're leaving?
2011-05-01,Season 1,Episode 3,Lord Snow,benjen stark,I'm the First Ranger. My job is out there. There have been disturbing reports.
2011-05-01,Season 1,Episode 3,Lord Snow,jon snow,What kind of reports?
2011-05-01,Season 1,Episode 3,Lord Snow,benjen stark,The kind I don't want to believe.
2011-05-01,Season 1,Episode 3,Lord Snow,jon snow,m ready. I won't let you down.
2011-05-01,Season 1,Episode 3,Lord Snow,benjen stark,"You're not going. You're no ranger, Jon."
2011-05-01,Season 1,Episode 3,Lord Snow,jon snow,But I'm better than every...
2011-05-01,Season 1,Episode 3,Lord Snow,benjen stark,"Better than no one! Here... A man gets what he earns, when he earns it. We'll speak when I return."
2011-05-01,Season 1,Episode 3,Lord Snow,yoren,A bear's balls.
2011-05-01,Season 1,Episode 3,Lord Snow,tyrion lannister,You're joking?
2011-05-01,Season 1,Episode 3,Lord Snow,yoren,"And his brains and his guts, his lungs and his heart all fried in his own fat. When you're a hundred miles north of the Wall and you ate your last meal a week ago, you leave nothing for the wolves."
2011-05-01,Season 1,Episode 3,Lord Snow,tyrion lannister,And how do a bear's balls taste?
2011-05-01,Season 1,Episode 3,Lord Snow,yoren,"A bit chewy. And what about you, my Lord? What's the strangest thing you've eaten?"
2011-05-01,Season 1,Episode 3,Lord Snow,tyrion lannister,"Do Dornish girls count? So you roam the Seven Kingdoms, collaring pickpockets and horse thieves and bringing them here as eager recruits?"
2011-05-01,Season 1,Episode 3,Lord Snow,yoren,But it's not all of 'em's done bad things. Some of 'em's just poor lads looking for steady feed. Some of 'em's high-born lads looking for glory.
2011-05-01,Season 1,Episode 3,Lord Snow,tyrion lannister,They have a better chance finding feed than glory.
2011-05-01,Season 1,Episode 3,Lord Snow,benjen stark,"The Night's Watch is a joke to you, is it? Is that what we are, Lannister? An army of jesters in black?"
2011-05-01,Season 1,Episode 3,Lord Snow,tyrion lannister,"You don't have enough men to be an army and aside from Yoren here, none of you are particularly funny."
2011-05-01,Season 1,Episode 3,Lord Snow,benjen stark,"I hope we've provided you with some good stories to tell when you're back in King's Landing. But something to think about while you're drinking your wine down there, enjoying your brothels... Half the boys you've seen training will die north of the Wall. Might be a wilding's axe that gets them, might be sickness, might just be the cold. They die in pain. And they do it so plump little lords like you can enjoy their summer afternoons in peace and comfort."
2011-05-01,Season 1,Episode 3,Lord Snow,tyrion lannister,"Do you think I'm plump? Listen, Benjen... May I call you Benjen?"
2011-05-01,Season 1,Episode 3,Lord Snow,benjen stark,Call me what you like.
2011-05-01,Season 1,Episode 3,Lord Snow,tyrion lannister,I'm not sure what I've done to offend you. I have great admiration for the Night's Watch. I've great admiration for you as First Ranger.
2011-05-01,Season 1,Episode 3,Lord Snow,benjen stark,"You know, my brother once told me that nothing someone says before the word ""but"" really counts."
2011-05-01,Season 1,Episode 3,Lord Snow,tyrion lannister,"But... I don't believe that giants and ghouls and White Walkers are lurking beyond the Wall. I believe that the only difference between us and the wildlings is that when the Wall went up, our ancestors happened to live on the right side of it."
2011-05-01,Season 1,Episode 3,Lord Snow,benjen stark,"You're right. The wildlings are no different from us. A little rougher maybe. But they're made of meat and bone. I know how to track them and I know how to kill them. It's not the wildlings giving me sleepless nights. You've never been north of the Wall, so don't tell me what's out there."
2011-05-01,Season 1,Episode 3,Lord Snow,yoren,"Are you going below? Keep well, keep warm."
2011-05-01,Season 1,Episode 3,Lord Snow,benjen stark,"Enjoy the capital, brother."
2011-05-01,Season 1,Episode 3,Lord Snow,yoren,I always do.
2011-05-01,Season 1,Episode 3,Lord Snow,tyrion lannister,"I think he's starting to like me. ""Going below""?"
2011-05-01,Season 1,Episode 3,Lord Snow,yoren,Into the tunnel and out the other side. He'll be north of the Wall for a month or two.
2011-05-01,Season 1,Episode 3,Lord Snow,tyrion lannister,So you're heading down to King's Landing too.
2011-05-01,Season 1,Episode 3,Lord Snow,yoren,Day after tomorrow. I get about half of my recruits from their dungeons.
2011-05-01,Season 1,Episode 3,Lord Snow,tyrion lannister,Let's share the road. I could use some decent company.
2011-05-01,Season 1,Episode 3,Lord Snow,yoren,"I travel a bit on the grubby side, my Lord."
2011-05-01,Season 1,Episode 3,Lord Snow,tyrion lannister,Not this time. We'll be staying at the finest castles and inns. No one turns away a Lannister.
2011-05-01,Season 1,Episode 3,Lord Snow,irri,"Yes, Khaleesi."
2011-05-01,Season 1,Episode 3,Lord Snow,daenerys targaryen,What are you doing?
2011-05-01,Season 1,Episode 3,Lord Snow,irri,"When was last time you bleed, Khaleesi? You change, Khaleesi. It's a blessing from the Great Stallion."
2011-05-01,Season 1,Episode 3,Lord Snow,jorah mormont,"For a man on horseback, the curved blade is a good thing, easier to handle. It's a good weapon for a Dothrakan. But a man in full plate... the arakh won't get through the steel. That's where the broadsword has the advantage. Designed for piercing plate."
2011-05-01,Season 1,Episode 3,Lord Snow,rakharo,Dothraki don't wear steel dresses.
2011-05-01,Season 1,Episode 3,Lord Snow,jorah mormont,Armor.
2011-05-01,Season 1,Episode 3,Lord Snow,rakharo,Armor. Armor make a man... Vroz?
2011-05-01,Season 1,Episode 3,Lord Snow,jorah mormont,Slow.
2011-05-01,Season 1,Episode 3,Lord Snow,rakharo,Slow.
2011-05-01,Season 1,Episode 3,Lord Snow,jorah mormont,"It's true, but it also keeps a man alive."
2011-05-01,Season 1,Episode 3,Lord Snow,rakharo,My father taught me how to fight. He taught me that speed defeats size.
2011-05-01,Season 1,Episode 3,Lord Snow,jorah mormont,I've heard that your father was a famous warrior.
2011-05-01,Season 1,Episode 3,Lord Snow,rakharo,"He was bloodrider to Khal Bharbo. And your father, Jorah the Andal? He was a warrior also?"
2011-05-01,Season 1,Episode 3,Lord Snow,jorah mormont,He still is. A man of great honor. And I betrayed him.
2011-05-01,Season 1,Episode 3,Lord Snow,irri,The Khaleesi wants to eat something different tonight. Kill some rabbits.
2011-05-01,Season 1,Episode 3,Lord Snow,rakharo,There are no rabbits.
2011-05-01,Season 1,Episode 3,Lord Snow,irri,"Find some ducks, she likes ducks."
2011-05-01,Season 1,Episode 3,Lord Snow,rakharo,"Have you seen any ducks, woman? No rabbits, no ducks. Do you have eyes in your head? Do you?"
2011-05-01,Season 1,Episode 3,Lord Snow,irri,Dog then. I have seen many dogs.
2011-05-01,Season 1,Episode 3,Lord Snow,jorah mormont,I don't think she wants to eat dog.
2011-05-01,Season 1,Episode 3,Lord Snow,irri,The Khaleesi have baby inside her. It is true. She does not bleed for two moons. Her belly start to swell.
2011-05-01,Season 1,Episode 3,Lord Snow,rakharo,A blessing from the Great Stallion.
2011-05-01,Season 1,Episode 3,Lord Snow,irri,She does not want to eat horse.
2011-05-01,Season 1,Episode 3,Lord Snow,jorah mormont,I'll have the boys butcher a goat for supper. I need to ride to Qohor.
2011-05-01,Season 1,Episode 3,Lord Snow,rhakaro,We ride for Vaes Dothrak.
2011-05-01,Season 1,Episode 3,Lord Snow,jorah mormont,Don't worry. I'll catch you. The horde's easy to find.
2011-05-01,Season 1,Episode 3,Lord Snow,jon snow,Don't stand so still. It's harder to hit a moving target. Except for you. You move too much. I could just hold my sword out and let you do the work for me.
2011-05-01,Season 1,Episode 3,Lord Snow,maester aemon,"How many winters have you seen, Lord Tyrion?"
2011-05-01,Season 1,Episode 3,Lord Snow,tyrion lannister,"Eight... no, nine."
2011-05-01,Season 1,Episode 3,Lord Snow,maester aemon,All of them brief?
2011-05-01,Season 1,Episode 3,Lord Snow,tyrion lannister,"They say the winter of my birth was three years long, Maester Aemon."
2011-05-01,Season 1,Episode 3,Lord Snow,maester aemon,This summer has lasted nine. But reports from the Citadel tell us the days grow shorter. The Starks are always right eventually
2011-05-01,Season 1,Episode 3,Lord Snow,jeor mormont,"We've been capturing wildlings, more every month. They're fleeing south. The ones who flee... say they've seen the White Walkers."
2011-05-01,Season 1,Episode 3,Lord Snow,tyrion lannister,"Yes, and the fishermen of Lannisport say they see mermaids."
2011-05-01,Season 1,Episode 3,Lord Snow,jeor mormont,One of our own rangers swore he saw them kill his companions. He swore it right up to the moment Ned Stark chopped his head off.
2011-05-01,Season 1,Episode 3,Lord Snow,maester aemon,The Night's Watch is the only thing standing between the realm and what lies beyond. And it has become an army of undisciplined boys and tired old men. There are less than a thousand of us now. We can't man the other castles on the Wall. We can't properly patrol the wilderness. We've barely enough resources to keep our lads armed and fed.
2011-05-01,Season 1,Episode 3,Lord Snow,jeor mormont,Your sister sits by the side of the King. Tell her we need help.
2011-05-01,Season 1,Episode 3,Lord Snow,maester aemon,"When winter does come, gods help us all if we're not ready."
2011-05-01,Season 1,Episode 3,Lord Snow,daenerys targaryen,It's a boy.
2011-05-01,Season 1,Episode 3,Lord Snow,khal drogo,How do you know?
2011-05-01,Season 1,Episode 3,Lord Snow,daenerys targaryen,I know.
2011-05-01,Season 1,Episode 3,Lord Snow,jon snow,"I'm sorry to see you leave, Lannister."
2011-05-01,Season 1,Episode 3,Lord Snow,tyrion lannister,It's either me or this cold. And it doesn't appear to be going anywhere.
2011-05-01,Season 1,Episode 3,Lord Snow,jon snow,Will you stop at Winterfell on your way South?
2011-05-01,Season 1,Episode 3,Lord Snow,tyrion lannister,I expect I will. Gods know there aren't many feather beds between here and King's Landing.
2011-05-01,Season 1,Episode 3,Lord Snow,jon snow,"If you see my brother Bran, tell him I miss him. Tell him I'd visit if I could."
2011-05-01,Season 1,Episode 3,Lord Snow,tyrion lannister,Of course.
2011-05-01,Season 1,Episode 3,Lord Snow,jon snow,He'll never walk again.
2011-05-01,Season 1,Episode 3,Lord Snow,tyrion lannister,"If you're going to be a cripple, it's better to be a rich cripple. Take care, Snow."
2011-05-01,Season 1,Episode 3,Lord Snow,jon snow,"Farewell, My Lord."
2011-05-01,Season 1,Episode 3,Lord Snow,syrio forel,"You are late, boy. Tomorrow you will be here at midday."
2011-05-01,Season 1,Episode 3,Lord Snow,arya stark,Who are you?
2011-05-01,Season 1,Episode 3,Lord Snow,syrio forel,"Your dancing master, Syrio Forel."
2011-05-01,Season 1,Episode 3,Lord Snow,syrio forel,"Tomorrow you will catch it. Now pick it up. That is not the way, boy. This is not a great sword that is needing two hands to swing it."
2011-05-01,Season 1,Episode 3,Lord Snow,arya stark,It's too heavy.
2011-05-01,Season 1,Episode 3,Lord Snow,syrio forel,It is heavy as it needs to be to make you strong. Just so. One hand is all that is needed. Now you are standing all wrong. Turn your body side-face. So. You are skinny. That is good. The target is smaller. Now the grip... Let me see. The grip must be delicate.
2011-05-01,Season 1,Episode 3,Lord Snow,arya stark,What if I drop it?
2011-05-01,Season 1,Episode 3,Lord Snow,syrio forel,"The steel must be part of your arm. Can you drop part of your arm? No. Nine years Syrio Forel was first sword to the Sealord of Braavos. He knows these things. You must listen to me, boy."
2011-05-01,Season 1,Episode 3,Lord Snow,arya stark,I'm a girl.
2011-05-01,Season 1,Episode 3,Lord Snow,syrio forel,"Boy, girl... You are a sword, that is all. That is the grip. You are not holding a battle-axe. You are holding..."
2011-05-01,Season 1,Episode 3,Lord Snow,arya stark,A needle.
2011-05-01,Season 1,Episode 3,Lord Snow,syrio forel,"Ahhh… Just so. Now we will begin the dance. Remember, child, this is not the dance of the Westeros we are learning... The knight's dance, hacking and hammering. This is the Bravo's dance... The water dance. It is swift and sudden. All men are made of water, do you know this? If you pierce them, the water leaks out and they die. Now you will try to strike me."
2011-05-01,Season 1,Episode 3,Lord Snow,syrio forel,"Up! Dead. Dead. Very dead. Come. Again, faster."
2011-05-08,Season 1,Episode 4,"Cripples, Bastards and Broken Things",old nan,The little Lordo s been dreaming again.
2011-05-08,Season 1,Episode 4,"Cripples, Bastards and Broken Things",theon greyjoy,We have visitors.
2011-05-08,Season 1,Episode 4,"Cripples, Bastards and Broken Things",bran stark,I don't want to see anyone.
2011-05-08,Season 1,Episode 4,"Cripples, Bastards and Broken Things",theon greyjoy,"Really? If I was cooped up all day with no one but this old bat for company, I'd go mad. Anyway, you don't have a choice. Robb's waiting."
2011-05-08,Season 1,Episode 4,"Cripples, Bastards and Broken Things",bran stark,I don't want to go.
2011-05-08,Season 1,Episode 4,"Cripples, Bastards and Broken Things",theon greyjoy,"Neither do I. But Robb's Lord of Winterfell, which means I do what he says and you do what I say. Hodor! Help Bran down the hall."
2011-05-08,Season 1,Episode 4,"Cripples, Bastards and Broken Things",tyrion lannister,I must say I received a slightly warmer welcome on my last visit.
2011-05-08,Season 1,Episode 4,"Cripples, Bastards and Broken Things",robb stark,Any man of the Night's Watch is welcome at Winterfell.
2011-05-08,Season 1,Episode 4,"Cripples, Bastards and Broken Things",tyrion lannister,"Any man of the Night's Watch, but not I, eh, boy?"
2011-05-08,Season 1,Episode 4,"Cripples, Bastards and Broken Things",robb stark,"I'm not your boy, Lannister. I'm Lord of Winterfell while my father is away."
2011-05-08,Season 1,Episode 4,"Cripples, Bastards and Broken Things",tyrion lannister,Then you might learn a lordo s courtesy.
2011-05-08,Season 1,Episode 4,"Cripples, Bastards and Broken Things",tyrion lannister,So it's true. Hello Bran. Do you remember anything about what happened?
2011-05-08,Season 1,Episode 4,"Cripples, Bastards and Broken Things",maester luwin,He has no memory of that day.
2011-05-08,Season 1,Episode 4,"Cripples, Bastards and Broken Things",tyrion lannister,Curious.
2011-05-08,Season 1,Episode 4,"Cripples, Bastards and Broken Things",robb stark,Why are you here?
2011-05-08,Season 1,Episode 4,"Cripples, Bastards and Broken Things",tyrion lannister,Would your charming companion be so kind as to kneel? My neck is beginning to hurt.
2011-05-08,Season 1,Episode 4,"Cripples, Bastards and Broken Things",bran stark,"Kneel, Hodor."
2011-05-08,Season 1,Episode 4,"Cripples, Bastards and Broken Things",tyrion lannister,"Do you like to ride, Bran?"
2011-05-08,Season 1,Episode 4,"Cripples, Bastards and Broken Things",bran stark,"Yes. Well, I mean I did like to."
2011-05-08,Season 1,Episode 4,"Cripples, Bastards and Broken Things",maester luwin,The boy has lost the use of his legs.
2011-05-08,Season 1,Episode 4,"Cripples, Bastards and Broken Things",tyrion lannister,"What of it? With the right horse and saddle, even a cripple can ride."
2011-05-08,Season 1,Episode 4,"Cripples, Bastards and Broken Things",bran stark,I'm not a cripple.
2011-05-08,Season 1,Episode 4,"Cripples, Bastards and Broken Things",tyrion lannister,Then I'm not a dwarf. My father will rejoice to hear it. I have a gift for you. Give that to your saddler. He'll provide the rest. You must shape the horse to the rider. Start with a yearling and teach it to respond to the reins and to the boy's voice.
2011-05-08,Season 1,Episode 4,"Cripples, Bastards and Broken Things",bran stark,Will I really be able to ride?
2011-05-08,Season 1,Episode 4,"Cripples, Bastards and Broken Things",tyrion lannister,You will. On horseback you will be as tall as any of them.
2011-05-08,Season 1,Episode 4,"Cripples, Bastards and Broken Things",robb stark,Is this some kind of trick? Why do you want to help him?
2011-05-08,Season 1,Episode 4,"Cripples, Bastards and Broken Things",tyrion lannister,"I have a tender spot in my heart for cripples, bastards and broken things."
2011-05-08,Season 1,Episode 4,"Cripples, Bastards and Broken Things",robb stark,You've done my brother a kindness. The hospitality of Winterfell is yours.
2011-05-08,Season 1,Episode 4,"Cripples, Bastards and Broken Things",tyrion lannister,"Spare me your false courtesies, Lord Stark. There's a brothel outside your walls. There I'll find a bed and both of us can sleep easier."
2011-05-08,Season 1,Episode 4,"Cripples, Bastards and Broken Things",theon greyjoy,"Couldn't resist some northern ass? If you like redheads, ask for Ros."
2011-05-08,Season 1,Episode 4,"Cripples, Bastards and Broken Things",tyrion lannister,"Come to see me off, Greyjoy? Kind of you. Your master doesn't seem to like Lannisters."
2011-05-08,Season 1,Episode 4,"Cripples, Bastards and Broken Things",theon greyjoy,He's not my master.
2011-05-08,Season 1,Episode 4,"Cripples, Bastards and Broken Things",tyrion lannister,"No, of course not. What happened here? Where is lady Stark? Why didn't she receive me?"
2011-05-08,Season 1,Episode 4,"Cripples, Bastards and Broken Things",theon greyjoy,She wasn't feeling well.
2011-05-08,Season 1,Episode 4,"Cripples, Bastards and Broken Things",tyrion lannister,"She's not in Winterfell, is she? Where did she go?"
2011-05-08,Season 1,Episode 4,"Cripples, Bastards and Broken Things",theon greyjoy,My lady's whereabouts...
2011-05-08,Season 1,Episode 4,"Cripples, Bastards and Broken Things",tyrion lannister,"My lady? Your loyalty to your captors is touching. Tell me, how do you think Balon Greyjoy would feel if he could see his only surviving son has turned lackey? I still remember seeing my father's fleet burn in Lannisport. I believe your uncles were responsible?"
2011-05-08,Season 1,Episode 4,"Cripples, Bastards and Broken Things",theon greyjoy,Must have been a pretty sight.
2011-05-08,Season 1,Episode 4,"Cripples, Bastards and Broken Things",tyrion lannister,"Nothing prettier than watching sailors burn alive. Yes, a great victory for your people. Shame how it all turned out."
2011-05-08,Season 1,Episode 4,"Cripples, Bastards and Broken Things",theon greyjoy,We were outnumbered 10 to one.
2011-05-08,Season 1,Episode 4,"Cripples, Bastards and Broken Things",tyrion lannister,"A stupid rebellion then. I suppose your father realized that when your brothers died in battle. Now here you are, your enemy's squire."
2011-05-08,Season 1,Episode 4,"Cripples, Bastards and Broken Things",theon greyjoy,"Careful, Imp."
2011-05-08,Season 1,Episode 4,"Cripples, Bastards and Broken Things",tyrion lannister,"I've offended you. Forgive me, it's been a rough morning. Anyway, don't despair. I'm a constant disappointment to my own father and I've learned to live with it. Your next tumble with Ros is on me. I'll try not to wear her out."
2011-05-08,Season 1,Episode 4,"Cripples, Bastards and Broken Things",jon snow,"Leg, shoulder, leg. Left foot forward. Good. Now pivot as you deliver the stroke. Put all your weight behind it."
2011-05-08,Season 1,Episode 4,"Cripples, Bastards and Broken Things",grenn,What in seven hells is that?
2011-05-08,Season 1,Episode 4,"Cripples, Bastards and Broken Things",pyp,They'll need an eighth hell to fit him in.
2011-05-08,Season 1,Episode 4,"Cripples, Bastards and Broken Things",alliser thorne,Tell them your name.
2011-05-08,Season 1,Episode 4,"Cripples, Bastards and Broken Things",sam tarly,"Samwell Tarly, of Horn Hill. I mean, I was of Horn Hill. I've come to take the black."
2011-05-08,Season 1,Episode 4,"Cripples, Bastards and Broken Things",rast,Come to take the black pudding.
2011-05-08,Season 1,Episode 4,"Cripples, Bastards and Broken Things",alliser thorne,"Well, you couldn't be any worse than you look. See what he can do."
2011-05-08,Season 1,Episode 4,"Cripples, Bastards and Broken Things",sam tarly,"I yield. Please, no more."
2011-05-08,Season 1,Episode 4,"Cripples, Bastards and Broken Things",alliser thorne,"On your feet. Pick up your sword. Hit him till he finds his feet. It seems they've run short of poachers and thieves down south. Now they send us squealing bloody pigs. Again, harder."
2011-05-08,Season 1,Episode 4,"Cripples, Bastards and Broken Things",jon snow,Enough! He yielded.
2011-05-08,Season 1,Episode 4,"Cripples, Bastards and Broken Things",alliser thorne,"Looks like the bastardo s in love. All right then, lord Snow, you wish to defend your lady love, let's make it an exercise. You two. Three of you ought to be sufficient to make lady piggy squeal. All you've got to do is get past the bastard."
2011-05-08,Season 1,Episode 4,"Cripples, Bastards and Broken Things",jon snow,Are you sure you want to do this?
2011-05-08,Season 1,Episode 4,"Cripples, Bastards and Broken Things",grenn,No. Yield yield yield! I yield.
2011-05-08,Season 1,Episode 4,"Cripples, Bastards and Broken Things",alliser thorne,We're done for today. Go clean the armory. That's all you're good for.
2011-05-08,Season 1,Episode 4,"Cripples, Bastards and Broken Things",pyp,Well fought!
2011-05-08,Season 1,Episode 4,"Cripples, Bastards and Broken Things",grenn,Piss off.
2011-05-08,Season 1,Episode 4,"Cripples, Bastards and Broken Things",sam tarly,Did he hurt you?
2011-05-08,Season 1,Episode 4,"Cripples, Bastards and Broken Things",jon snow,I've had worse.
2011-05-08,Season 1,Episode 4,"Cripples, Bastards and Broken Things",sam tarly,You can call me Sam... If you want. My mother calls me Sam.
2011-05-08,Season 1,Episode 4,"Cripples, Bastards and Broken Things",jon snow,"It's not going to get any easier, you know? You'll have to defend yourself."
2011-05-08,Season 1,Episode 4,"Cripples, Bastards and Broken Things",grenn,Why didn't you get up and fight?
2011-05-08,Season 1,Episode 4,"Cripples, Bastards and Broken Things",sam tarly,I wanted to. I just couldn't.
2011-05-08,Season 1,Episode 4,"Cripples, Bastards and Broken Things",grenn,Why not?
2011-05-08,Season 1,Episode 4,"Cripples, Bastards and Broken Things",sam tarly,I'm a coward. My father always says so.
2011-05-08,Season 1,Episode 4,"Cripples, Bastards and Broken Things",jon snow,The Wall's no place for cowards.
2011-05-08,Season 1,Episode 4,"Cripples, Bastards and Broken Things",sam tarly,You're right. I'm sorry. I just... Wanted to thank you.
2011-05-08,Season 1,Episode 4,"Cripples, Bastards and Broken Things",grenn,A bloody coward. People saw us talking to him. Now they'll think we're cowards too.
2011-05-08,Season 1,Episode 4,"Cripples, Bastards and Broken Things",pyp,You're too stupid to be a coward.
2011-05-08,Season 1,Episode 4,"Cripples, Bastards and Broken Things",grenn,You're too stupid to be a...
2011-05-08,Season 1,Episode 4,"Cripples, Bastards and Broken Things",pyp,"Quick now, before summer's over."
2011-05-08,Season 1,Episode 4,"Cripples, Bastards and Broken Things",grenn,Come on here!
2011-05-08,Season 1,Episode 4,"Cripples, Bastards and Broken Things",jorah mormont,Vaes Dothrak. The city of the horselords.
2011-05-08,Season 1,Episode 4,"Cripples, Bastards and Broken Things",viserys targaryen,A pile of mud. Mud and shit and twigs - best these savages can do.
2011-05-08,Season 1,Episode 4,"Cripples, Bastards and Broken Things",daenerys targaryen,These are my people now. You shouldn't call them savages.
2011-05-08,Season 1,Episode 4,"Cripples, Bastards and Broken Things",viserys targaryen,"I'll call them what I like, because they're my people. This is my army. Khal Drogo is marching the wrong way with my army."
2011-05-08,Season 1,Episode 4,"Cripples, Bastards and Broken Things",daenerys targaryen,"If my brother was given an army of Dothraki, could you conquer the Seven Kingdoms?"
2011-05-08,Season 1,Episode 4,"Cripples, Bastards and Broken Things",jorah mormont,The Dothraki have never crossed the Narrow Sea. They fear any water their horses can't drink.
2011-05-08,Season 1,Episode 4,"Cripples, Bastards and Broken Things",daenerys targaryen,But if they did?
2011-05-08,Season 1,Episode 4,"Cripples, Bastards and Broken Things",jorah mormont,"King Robert is fool enough to meet them in open battle, but the men advising him are different."
2011-05-08,Season 1,Episode 4,"Cripples, Bastards and Broken Things",daenerys targaryen,And you know these men?
2011-05-08,Season 1,Episode 4,"Cripples, Bastards and Broken Things",jorah mormont,"I fought beside them once, long ago. Now Ned Stark wants my head. He drove me from my land."
