Release Date,Season,Episode,Episode Title,Name,Sentence
2011-06-19,Season 1,Episode 10,Fire and Blood,hot pie,"Watch yourself, midget."
2011-06-19,Season 1,Episode 10,Fire and Blood,hot pie,What's a gutter rat like you doing with a sword?
2011-06-19,Season 1,Episode 10,Fire and Blood,hot pie,He ain't no squire. Look at him. He looks like a girl. l bet he stole that sword.
2011-06-19,Season 1,Episode 10,Fire and Blood,hot pie,l could use me a sword like that.
2011-06-19,Season 1,Episode 10,Fire and Blood,hot pie,"Give it here, midget."
2011-06-19,Season 1,Episode 10,Fire and Blood,hot pie,l knocked him down and l kicked him in the balls and l kept kicking him until he was dead. l kicked him all to pieces. You better give me that sword!
2012-04-08,Season 2,Episode 2,The Night Lands,hot pie,I'm not afraid of no battles.
2012-04-08,Season 2,Episode 2,The Night Lands,hot pie,I've seen lots of battles. I saw -
2012-04-08,Season 2,Episode 2,The Night Lands,hot pie,I saw a man kill another man just outside a tavern in Flea Bottom. Stabbed him right in the neck.
2012-04-08,Season 2,Episode 2,The Night Lands,hot pie,They had armor on.
2012-04-08,Season 2,Episode 2,The Night Lands,hot pie,"So, if they got armor on, it's a battle."
2012-04-08,Season 2,Episode 2,The Night Lands,hot pie,What's a dyer's apprentice know about battles anyway?
2012-04-08,Season 2,Episode 2,The Night Lands,hot pie,It's when they've got armor on.
2012-04-08,Season 2,Episode 2,The Night Lands,hot pie,A knight?
2012-04-08,Season 2,Episode 2,The Night Lands,hot pie,"Well, cause he got armor on."
2012-04-08,Season 2,Episode 2,The Night Lands,hot pie,How'd you know?
2012-04-22,Season 2,Episode 4,Garden of Bones,hot pie,What kind of fire melts stone?
2012-04-22,Season 2,Episode 4,Garden of Bones,hot pie,There's dragons here?
2012-04-22,Season 2,Episode 4,Garden of Bones,hot pie,What's that smell?
2012-04-22,Season 2,Episode 4,Garden of Bones,hot pie,"That's him, the one who picks."
2012-04-22,Season 2,Episode 4,Garden of Bones,hot pie,He told me he stares at him every day. That's why he doesn't get picked.
2012-05-20,Season 2,Episode 8,The Prince of Winterfell,hot pie,"You need sour cherries to make it right. And the secret is you dry the stones, and then you break them with a mallet. That's where the real flavor is. You crush 'em up real fine. And then when you're finished, you sprinkle them over the piecrust."
2012-05-20,Season 2,Episode 8,The Prince of Winterfell,hot pie,How would I know?
2012-05-20,Season 2,Episode 8,The Prince of Winterfell,hot pie,I saw him.
2012-05-20,Season 2,Episode 8,The Prince of Winterfell,hot pie,Ow!
2012-05-20,Season 2,Episode 8,The Prince of Winterfell,hot pie,They went riding out the gates a few hours ago.
2012-05-20,Season 2,Episode 8,The Prince of Winterfell,hot pie,On patrol. Let go of my ears.
2012-05-20,Season 2,Episode 8,The Prince of Winterfell,hot pie,What do you want with him anyway?
2012-05-20,Season 2,Episode 8,The Prince of Winterfell,hot pie,The sour cherries was all crushed up and ready.
2012-05-20,Season 2,Episode 8,The Prince of Winterfell,hot pie,"Probably in the piecrust by now. In the oven. The nice, warm oven."
2012-05-20,Season 2,Episode 8,The Prince of Winterfell,hot pie,The cheese could be better. I did get some nice sausages.
2012-05-20,Season 2,Episode 8,The Prince of Winterfell,hot pie,I want to go back to the kitchens.
2012-06-03,Season 2,Episode 10,Valar Morghulis,hot pie,How did he find us?
2013-04-07,Season 3,Episode 2,"Dark Wings, Dark Words",hot pie,"A minstrel's got gold sometimes. We could jump him, tie him up, steal his gold, and buy some food."
2013-04-07,Season 3,Episode 2,"Dark Wings, Dark Words",hot pie,I'm not going with them. The Brotherhood? That's who the Mountain and them lot were looking for. They'll bring us back and put rats in us.
2013-04-14,Season 3,Episode 3,Walk of Punishment,hot pie,I'm staying.
2013-04-14,Season 3,Episode 3,Walk of Punishment,hot pie,"I baked some brown bread for the innkeep and she said she never had better. Told Thoros she's keeping me as a payment for all the free meals she's given him. Anyway, it's not me the Brotherhood wants. My brother ain't no king. I'm not a Stark of ""Winterhell""."
2013-04-14,Season 3,Episode 3,Walk of Punishment,hot pie,You sure?
2013-04-14,Season 3,Episode 3,Walk of Punishment,hot pie,"Well, I made you something."
2013-04-14,Season 3,Episode 3,Walk of Punishment,hot pie,It's a wolf.
2013-04-14,Season 3,Episode 3,Walk of Punishment,hot pie,Yeah.
2013-04-14,Season 3,Episode 3,Walk of Punishment,hot pie,"Yeah, you, too. Don't get stabbed."
2013-04-14,Season 3,Episode 3,Walk of Punishment,hot pie,"Good-bye, Arry."
2014-05-18,Season 4,Episode 7,Mockingbird,hot pie,Can I get you anything else?
2014-05-18,Season 4,Episode 7,Mockingbird,hot pie,Thanks. I do my best.
2014-05-18,Season 4,Episode 7,Mockingbird,hot pie,"A good kidney pie is all about the ingredients. Flour, lard, water, eggs, milk. Easy enough. But the meat, peacetime or not, getting your hands on a good bottom round steak and calves' kidneys is not easy. I mean, some people settle for plain old beef kidneys. Got no right to cook anything, them. Oh, and the gravy. Don't get me started on the gravy. Very difficult to get right. See, a lot of people give up on the gravy. You cannot give up on the gravy. No gravy, no pie. Simple as that. That's nice armor. Are you a knight?"
2014-05-18,Season 4,Episode 7,Mockingbird,hot pie,"Oh, it's just people with armor are usually knights. Generally speaking. From King's Landing, though, aren't you? From there myself originally. Flea Bottom born and bred. What brings you to these parts?"
2014-05-18,Season 4,Episode 7,Mockingbird,hot pie,Someone in particular? Maybe they came in here. A lot of people come in here. Just the other day we had seventeen-
2014-05-18,Season 4,Episode 7,Mockingbird,hot pie,"Starks? What, like them lot from ""Winterhell""?"
2014-05-18,Season 4,Episode 7,Mockingbird,hot pie,"No, ain't seen anyone like that. I heard they was all traitors. Don't need no traitors in here."
2014-05-18,Season 4,Episode 7,Mockingbird,hot pie,Sure I can't get you a bit more kidney pie?
2014-05-18,Season 4,Episode 7,Mockingbird,hot pie,My lady. My lord. Could I have a word?
2014-05-18,Season 4,Episode 7,Mockingbird,hot pie,You seem like a proper lady. Someone who could be trusted. I never met no Sansa Stark. But I know her sister... Arya.
2014-05-18,Season 4,Episode 7,Mockingbird,hot pie,She weren't when I last spoke to her.
2014-05-18,Season 4,Episode 7,Mockingbird,hot pie,"Heading up north with the Night's Watch. She was all dressed up as a boy. Like your ladyship, only without the armor. Going by the name Arry."
2014-05-18,Season 4,Episode 7,Mockingbird,hot pie,Well-
2014-05-18,Season 4,Episode 7,Mockingbird,hot pie,The Lannisters took us prisoner. We escaped. The Brotherhood took us prisoner. They sold me to the innkeep. They were gonna sell Arya to her mother at Riverrun along with another prisoner. Big ugly fellow. Foul mouth and a face like a half-burnt ham. Not friendly.
2014-05-18,Season 4,Episode 7,Mockingbird,hot pie,"That's the one. If you find her, could you give her this? She liked the last one I gave her, but, well, this one turned out better."
2017-07-23,Season 7,Episode 2,Stormborn,hot pie,Ary!
2017-07-23,Season 7,Episode 2,Stormborn,hot pie,You think so? The secret is browning the butter before making the dough. Most people don't don't do that because it takes up too much time.
2017-07-23,Season 7,Episode 2,Stormborn,hot pie,You've been making pies?
2017-07-23,Season 7,Episode 2,Stormborn,hot pie,I can't believe you're here. Did you meet the big lady?
2017-07-23,Season 7,Episode 2,Stormborn,hot pie,The lady knight. I figured she was a knight because she had armor on. She was looking for your sister but I told her about you. Did she ever find you?
2017-07-23,Season 7,Episode 2,Stormborn,hot pie,What happened to you Ary?
2017-07-23,Season 7,Episode 2,Stormborn,hot pie,Where are you heading?
2017-07-23,Season 7,Episode 2,Stormborn,hot pie,Why?
2017-07-23,Season 7,Episode 2,Stormborn,hot pie,I heard she blew up the Great Sept. That must have been something to see. Boom.
2017-07-23,Season 7,Episode 2,Stormborn,hot pie,I can't believe someone could do that.
2017-07-23,Season 7,Episode 2,Stormborn,hot pie,I thought you'd be heading for Winterfell.
2017-07-23,Season 7,Episode 2,Stormborn,hot pie,No. The Boltons are dead.
2017-07-23,Season 7,Episode 2,Stormborn,hot pie,Jon Snow came down from Castle Black with a Wildling army and won the Battle of the Bastards. He's King in the North now.
2017-07-23,Season 7,Episode 2,Stormborn,hot pie,Why would I lie about that? He's your brother right?
2017-07-23,Season 7,Episode 2,Stormborn,hot pie,Friends don't pay. I can't believe I thought you were a boy. You're pretty.
2017-07-23,Season 7,Episode 2,Stormborn,hot pie,"No, I won't. I'm like you, Ary. I'm a survivor."
