Release Date,Season,Episode,Episode Title,Name,Sentence
2016-06-19,Season 6,Episode 9,Battle of the Bastards,melisandre,I don't know. Maybe you're only needed for this small part of his plan and nothing else. Maybe he brought you here to die again.
2016-06-19,Season 6,Episode 9,Battle of the Bastards,melisandre,The one we've got.
2016-06-26,Season 6,Episode 10,The Winds of Winter,melisandre,"Could have been worse, Jon Snow. You had a family. You had feasts."
2016-06-26,Season 6,Episode 10,The Winds of Winter,melisandre,The Princess Shireen.
2016-06-26,Season 6,Episode 10,The Winds of Winter,melisandre,We burned her at the stake.
2016-06-26,Season 6,Episode 10,The Winds of Winter,melisandre,The army was trapped. The horses were dying. It was the only way.
2016-06-26,Season 6,Episode 10,The Winds of Winter,melisandre,I only do what my Lord commands!
2016-06-26,Season 6,Episode 10,The Winds of Winter,melisandre,We are standing here because of him. Jon Snow is alive because the Lord willed it.
2016-06-26,Season 6,Episode 10,The Winds of Winter,melisandre,So did her father. So did her mother. Her own blood knew it was the only way.
2016-06-26,Season 6,Episode 10,The Winds of Winter,melisandre,I didn't lie. I was wrong.
2016-06-26,Season 6,Episode 10,The Winds of Winter,melisandre,"I've been ready to die for many years. If the Lord was done with me, so be it, but he's not. You've seen the Night King, Jon Snow. You know the great war is still to come. You know the army of the dead will be upon us soon. And you know I can help you win that war."
2017-07-23,Season 7,Episode 2,Stormborn,melisandre,"Queen Daeneys, I was a slave once, bought and sold, scourged and branded. It is an honor to meet the Breaker of Chains."
2017-07-23,Season 7,Episode 2,Stormborn,melisandre,I am called Melisandre.
2017-07-23,Season 7,Episode 2,Stormborn,melisandre,"No, it didn't."
2017-07-23,Season 7,Episode 2,Stormborn,melisandre,Not yet. But even those who don't worship the Lord can serve his cause.
2017-07-23,Season 7,Episode 2,Stormborn,melisandre,The Long Night is coming. Only the prince who was promised can bring the dawn.
2017-07-23,Season 7,Episode 2,Stormborn,melisandre,"Prophecies are dangerous things. I believe you have a role to play, as does another. The King in the North, Jon Snow."
2017-07-23,Season 7,Episode 2,Stormborn,melisandre,As Lord Commander of the Night's Watch he allowed the Wildlings south of the Wall to protect them from great danger. As King in the North he has united those Wildlings with the northern houses so together they may face their common enemy.
2017-07-23,Season 7,Episode 2,Stormborn,melisandre,"Summon Jon Snow. Let him stand before you and tell you things that have happened to him, the things that he has seen with his own eyes."
2017-07-30,Season 7,Episode 3,The Queen’s Justice,melisandre,I've done my part. I've brought ice and fire together.
2017-07-30,Season 7,Episode 3,The Queen’s Justice,melisandre,My time whispering in the ears of kings has come to an end.
2017-07-30,Season 7,Episode 3,The Queen’s Justice,melisandre,"Neither of us is common folk anymore. I did not part on good terms with the King in the North, or his advisor."
2017-07-30,Season 7,Episode 3,The Queen’s Justice,melisandre,Because of mistakes I made. Terrible mistakes. I would only be a distraction if I stayed.
2017-07-30,Season 7,Episode 3,The Queen’s Justice,melisandre,Volantis.
2017-07-30,Season 7,Episode 3,The Queen’s Justice,melisandre,"I will return, dear spider. One last time."
2017-07-30,Season 7,Episode 3,The Queen’s Justice,melisandre,"I have to die in this strange country, just like you."
2019-04-28,Season 8,Episode 3,The Long Night,melisandre,Do you speak their tongue?
2019-04-28,Season 8,Episode 3,The Long Night,melisandre,Tell them to lift their swords.
2019-04-28,Season 8,Episode 3,The Long Night,melisandre,Valar morghulis.
2019-04-28,Season 8,Episode 3,The Long Night,melisandre,"There's no need to execute me, Ser Davos. I'll be dead before the dawn."
2019-04-28,Season 8,Episode 3,The Long Night,melisandre,"Lord of Light, cast your light upon us. Lord of Light, defend us. For the night is dark and full of terrors!"
2019-04-28,Season 8,Episode 3,The Long Night,melisandre,"Lord of Light, cast your light upon us! Lord of Light, defend us! For the night is dark and full of terrors!"
2019-04-28,Season 8,Episode 3,The Long Night,melisandre,The Lord brought him back for a purpose. Now that purpose has been served.
2019-04-28,Season 8,Episode 3,The Long Night,melisandre,And I know you.
2019-04-28,Season 8,Episode 3,The Long Night,melisandre,And here we are. At the end of the world.
2019-04-28,Season 8,Episode 3,The Long Night,melisandre,Brown eyes... green eyes... and blue eyes.
2019-04-28,Season 8,Episode 3,The Long Night,melisandre,What do we say to the God of Death?
